{
  "name": "maple-tree",
  "description": "Japanese maple with spreading red/orange canopy",
  "root": "maple_root",
  "parts": [
    {
      "name": "maple_root",
      "type": "group",
      "position": [0, 0, 0]
    },
    {
      "name": "trunk",
      "type": "cylinder",
      "params": [0.1, 0.15, 1.2, 8],
      "material": { "preset": "wood", "color": "#4a3a30" },
      "position": [0, 0.6, 0],
      "parent": "maple_root"
    },
    {
      "name": "branch_main_1",
      "type": "cylinder",
      "params": [0.05, 0.07, 0.8, 6],
      "material": { "preset": "wood", "color": "#4a3a30" },
      "position": [-0.35, 1.3, 0],
      "rotation": [0, 0, -45],
      "parent": "maple_root"
    },
    {
      "name": "branch_main_2",
      "type": "cylinder",
      "params": [0.04, 0.06, 0.7, 6],
      "material": { "preset": "wood", "color": "#4a3a30" },
      "position": [0.3, 1.25, 0.15],
      "rotation": [15, 0, 40],
      "parent": "maple_root"
    },
    {
      "name": "branch_main_3",
      "type": "cylinder",
      "params": [0.035, 0.05, 0.6, 6],
      "material": { "preset": "wood", "color": "#4a3a30" },
      "position": [0.1, 1.35, -0.3],
      "rotation": [-30, 0, 20],
      "parent": "maple_root"
    },
    {
      "name": "canopy_center",
      "type": "icosahedron",
      "params": [0.6, 1],
      "material": { "preset": "foliage", "color": "#aa3030" },
      "position": [0, 1.8, 0],
      "scale": [1.2, 0.6, 1.2],
      "parent": "maple_root"
    },
    {
      "name": "canopy_left",
      "type": "icosahedron",
      "params": [0.5, 1],
      "material": { "preset": "foliage", "color": "#cc5030" },
      "position": [-0.7, 1.6, 0],
      "scale": [1, 0.5, 1],
      "parent": "maple_root"
    },
    {
      "name": "canopy_right",
      "type": "icosahedron",
      "params": [0.45, 1],
      "material": { "preset": "foliage", "color": "#aa3030" },
      "position": [0.6, 1.55, 0.2],
      "scale": [1, 0.5, 1],
      "parent": "maple_root"
    },
    {
      "name": "canopy_back",
      "type": "icosahedron",
      "params": [0.4, 1],
      "material": { "preset": "foliage", "color": "#bb4030" },
      "position": [0.2, 1.65, -0.5],
      "scale": [1, 0.5, 1],
      "parent": "maple_root"
    }
  ]
}
