{
  "name": "bike-handlebars",
  "description": "Motorcycle handlebar cluster for first-person POV foreground shots — bar, grips, levers, mirrors, glowing dash, headlight cowl. Origin at bar center; front faces -Z.",
  "root": "hb_root",
  "parts": [
    {
      "name": "hb_root",
      "type": "group",
      "position": [0, 0, 0]
    },
    {
      "name": "hb_bar",
      "type": "cylinder",
      "params": [0.016, 0.016, 0.66, 8],
      "material": { "preset": "chrome" },
      "position": [0, 0, 0],
      "rotation": [0, 0, 90],
      "parent": "hb_root"
    },
    {
      "name": "hb_riser_l",
      "type": "cylinder",
      "params": [0.02, 0.02, 0.12, 6],
      "material": { "preset": "chrome" },
      "position": [-0.09, -0.06, 0.01],
      "rotation": [8, 0, 0],
      "parent": "hb_root"
    },
    {
      "name": "hb_riser_r",
      "type": "cylinder",
      "params": [0.02, 0.02, 0.12, 6],
      "material": { "preset": "chrome" },
      "position": [0.09, -0.06, 0.01],
      "rotation": [8, 0, 0],
      "parent": "hb_root"
    },
    {
      "name": "hb_clamp",
      "type": "roundedBox",
      "params": [0.24, 0.05, 0.12, 0.01, 2],
      "material": { "color": "#22262c", "metalness": 0.6, "roughness": 0.5 },
      "position": [0, -0.12, 0],
      "parent": "hb_root"
    },
    {
      "name": "hb_fork_l",
      "type": "cylinder",
      "params": [0.026, 0.023, 0.55, 8],
      "material": { "preset": "chrome" },
      "position": [-0.16, -0.38, -0.05],
      "rotation": [12, 0, 0],
      "parent": "hb_root"
    },
    {
      "name": "hb_fork_r",
      "type": "cylinder",
      "params": [0.026, 0.023, 0.55, 8],
      "material": { "preset": "chrome" },
      "position": [0.16, -0.38, -0.05],
      "rotation": [12, 0, 0],
      "parent": "hb_root"
    },
    {
      "name": "hb_grip_l",
      "type": "cylinder",
      "params": [0.022, 0.022, 0.13, 8],
      "material": { "preset": "rubber" },
      "position": [-0.3, 0, 0],
      "rotation": [0, 0, 90],
      "parent": "hb_root"
    },
    {
      "name": "hb_grip_r",
      "type": "cylinder",
      "params": [0.022, 0.022, 0.13, 8],
      "material": { "preset": "rubber" },
      "position": [0.3, 0, 0],
      "rotation": [0, 0, 90],
      "parent": "hb_root"
    },
    {
      "name": "hb_lever_l",
      "type": "cylinder",
      "params": [0.007, 0.005, 0.15, 6],
      "material": { "color": "#33383f", "metalness": 0.7, "roughness": 0.4 },
      "position": [-0.25, 0.01, -0.07],
      "rotation": [0, 20, 90],
      "parent": "hb_root"
    },
    {
      "name": "hb_lever_r",
      "type": "cylinder",
      "params": [0.007, 0.005, 0.15, 6],
      "material": { "color": "#33383f", "metalness": 0.7, "roughness": 0.4 },
      "position": [0.25, 0.01, -0.07],
      "rotation": [0, -20, 90],
      "parent": "hb_root"
    },
    {
      "name": "hb_mirror_stem_l",
      "type": "cylinder",
      "params": [0.007, 0.007, 0.15, 5],
      "material": { "preset": "chrome" },
      "position": [-0.24, 0.09, 0.01],
      "rotation": [0, 0, 30],
      "parent": "hb_root"
    },
    {
      "name": "hb_mirror_stem_r",
      "type": "cylinder",
      "params": [0.007, 0.007, 0.15, 5],
      "material": { "preset": "chrome" },
      "position": [0.24, 0.09, 0.01],
      "rotation": [0, 0, -30],
      "parent": "hb_root"
    },
    {
      "name": "hb_mirror_l",
      "type": "roundedBox",
      "params": [0.11, 0.07, 0.018, 0.008, 2],
      "material": { "preset": "chrome" },
      "position": [-0.3, 0.17, 0.01],
      "rotation": [-8, 15, 0],
      "parent": "hb_root"
    },
    {
      "name": "hb_mirror_r",
      "type": "roundedBox",
      "params": [0.11, 0.07, 0.018, 0.008, 2],
      "material": { "preset": "chrome" },
      "position": [0.3, 0.17, 0.01],
      "rotation": [-8, -15, 0],
      "parent": "hb_root"
    },
    {
      "name": "hb_dash",
      "type": "roundedBox",
      "params": [0.18, 0.09, 0.07, 0.012, 2],
      "material": { "color": "#1a1d22", "metalness": 0.3, "roughness": 0.7 },
      "position": [0, 0.01, -0.12],
      "rotation": [-35, 0, 0],
      "parent": "hb_root"
    },
    {
      "name": "hb_gauge_main",
      "type": "cylinder",
      "params": [0.042, 0.042, 0.012, 14],
      "material": { "preset": "glow", "color": "#44ff88", "emissiveIntensity": 0.6 },
      "position": [-0.035, 0.045, -0.1],
      "rotation": [-35, 0, 0],
      "parent": "hb_root"
    },
    {
      "name": "hb_gauge_aux",
      "type": "cylinder",
      "params": [0.026, 0.026, 0.012, 12],
      "material": { "preset": "glow", "color": "#ffaa44", "emissiveIntensity": 0.5 },
      "position": [0.05, 0.04, -0.105],
      "rotation": [-35, 0, 0],
      "parent": "hb_root"
    },
    {
      "name": "hb_cowl",
      "type": "roundedBox",
      "params": [0.2, 0.15, 0.11, 0.03, 2],
      "material": { "preset": "painted-metal", "color": "#8a2f26" },
      "position": [0, -0.1, -0.17],
      "rotation": [-10, 0, 0],
      "parent": "hb_root"
    },
    {
      "name": "hb_headlight",
      "type": "cylinder",
      "params": [0.06, 0.06, 0.025, 12],
      "material": { "preset": "glow", "color": "#fff2cc", "emissiveIntensity": 0.9 },
      "position": [0, -0.09, -0.235],
      "rotation": [80, 0, 0],
      "parent": "hb_root"
    },
    {
      "name": "hb_headlight_rim",
      "type": "torus",
      "params": [0.062, 0.009, 8, 16],
      "material": { "preset": "chrome" },
      "position": [0, -0.09, -0.24],
      "rotation": [-10, 0, 0],
      "parent": "hb_root"
    }
  ]
}
