{
  "name": "tuk-tuk",
  "description": "Thai tuk-tuk three-wheeled taxi",
  "root": "tuktuk_root",
  "parts": [
    {
      "name": "tuktuk_root",
      "type": "group",
      "position": [0, 0, 0]
    },
    {
      "name": "tuktuk_body",
      "type": "roundedBox",
      "params": [1.0, 1.0, 1.8, 0.05, 2],
      "material": { "preset": "painted-metal", "color": "#ff6633" },
      "position": [0, 0.6, 0],
      "parent": "tuktuk_root"
    },
    {
      "name": "tuktuk_roof",
      "type": "roundedBox",
      "params": [1.1, 0.08, 1.6, 0.03, 2],
      "material": { "preset": "painted-metal", "color": "#ffcc00" },
      "position": [0, 1.15, 0.1],
      "parent": "tuktuk_root"
    },
    {
      "name": "tuktuk_front",
      "type": "roundedBox",
      "params": [0.6, 0.7, 0.5, 0.04, 2],
      "material": { "preset": "painted-metal", "color": "#ff6633" },
      "position": [0, 0.45, -1.1],
      "parent": "tuktuk_root"
    },
    {
      "name": "tuktuk_windshield",
      "type": "roundedBox",
      "params": [0.5, 0.4, 0.02, 0.01, 2],
      "material": { "preset": "glass" },
      "position": [0, 0.85, -0.85],
      "rotation": [20, 0, 0],
      "parent": "tuktuk_root"
    },
    {
      "name": "tuktuk_seat",
      "type": "roundedBox",
      "params": [0.9, 0.15, 0.7, 0.02, 2],
      "material": { "preset": "leather", "color": "#442222" },
      "position": [0, 0.45, 0.4],
      "parent": "tuktuk_root"
    },
    {
      "name": "tuktuk_backrest",
      "type": "roundedBox",
      "params": [0.9, 0.5, 0.08, 0.02, 2],
      "material": { "preset": "leather", "color": "#442222" },
      "position": [0, 0.75, 0.75],
      "parent": "tuktuk_root"
    },
    {
      "name": "tuktuk_wheel_front",
      "type": "cylinder",
      "params": [0.2, 0.2, 0.1, 12],
      "material": { "preset": "rubber" },
      "position": [0, 0.2, -1.1],
      "rotation": [0, 0, 90],
      "parent": "tuktuk_root"
    },
    {
      "name": "tuktuk_wheel_bl",
      "type": "cylinder",
      "params": [0.22, 0.22, 0.12, 12],
      "material": { "preset": "rubber" },
      "position": [-0.55, 0.22, 0.6],
      "rotation": [0, 0, 90],
      "parent": "tuktuk_root"
    },
    {
      "name": "tuktuk_wheel_br",
      "type": "cylinder",
      "params": [0.22, 0.22, 0.12, 12],
      "material": { "preset": "rubber" },
      "position": [0.55, 0.22, 0.6],
      "rotation": [0, 0, 90],
      "parent": "tuktuk_root"
    },
    {
      "name": "tuktuk_handlebar",
      "type": "cylinder",
      "params": [0.02, 0.02, 0.5, 6],
      "material": { "preset": "chrome" },
      "position": [0, 0.75, -0.9],
      "rotation": [0, 0, 90],
      "parent": "tuktuk_root"
    },
    {
      "name": "tuktuk_headlight",
      "type": "sphere",
      "params": [0.08, 1],
      "material": { "preset": "glow", "color": "#ffffaa", "emissiveIntensity": 2.5 },
      "position": [0, 0.5, -1.38],
      "parent": "tuktuk_root"
    },
    {
      "name": "tuktuk_taillight_l",
      "type": "roundedBox",
      "params": [0.08, 0.12, 0.02, 0.01, 2],
      "material": { "preset": "glow", "color": "#ff2200", "emissiveIntensity": 2.0 },
      "position": [-0.45, 0.5, 0.9],
      "parent": "tuktuk_root"
    },
    {
      "name": "tuktuk_taillight_r",
      "type": "roundedBox",
      "params": [0.08, 0.12, 0.02, 0.01, 2],
      "material": { "preset": "glow", "color": "#ff2200", "emissiveIntensity": 2.0 },
      "position": [0.45, 0.5, 0.9],
      "parent": "tuktuk_root"
    }
  ]
}
