{
  "name": "human-sitting",
  "description": "Seated human figure on invisible chair",
  "root": "figure_root",
  "parts": [
    {
      "name": "figure_root",
      "type": "group",
      "position": [0, 0, 0]
    },
    {
      "name": "hips",
      "type": "roundedBox",
      "params": [0.3, 0.14, 0.22, 0.03, 2],
      "material": { "preset": "fabric", "color": "#1e3a5f" },
      "position": [0, 0.48, 0],
      "parent": "figure_root"
    },
    {
      "name": "torso",
      "type": "roundedBox",
      "params": [0.35, 0.4, 0.2, 0.04, 2],
      "material": { "preset": "fabric", "color": "#2d6a4f" },
      "position": [0, 0.82, -0.02],
      "rotation": [-5, 0, 0],
      "parent": "figure_root"
    },
    {
      "name": "chest",
      "type": "roundedBox",
      "params": [0.38, 0.2, 0.22, 0.04, 2],
      "material": { "preset": "fabric", "color": "#2d6a4f" },
      "position": [0, 1.05, -0.03],
      "rotation": [-5, 0, 0],
      "parent": "figure_root"
    },
    {
      "name": "neck",
      "type": "cylinder",
      "params": [0.06, 0.06, 0.1, 6],
      "material": { "color": "#e8c4a0", "roughness": 0.9 },
      "position": [0, 1.2, -0.04],
      "parent": "figure_root"
    },
    {
      "name": "head",
      "type": "roundedBox",
      "params": [0.18, 0.22, 0.2, 0.05, 2],
      "material": { "color": "#e8c4a0", "roughness": 0.9 },
      "position": [0, 1.38, -0.04],
      "parent": "figure_root"
    },
    {
      "name": "hair",
      "type": "roundedBox",
      "params": [0.19, 0.12, 0.21, 0.03, 2],
      "material": { "color": "#5c3a1e", "roughness": 0.95 },
      "position": [0, 1.48, -0.05],
      "parent": "figure_root"
    },
    {
      "name": "upper_arm_l",
      "type": "capsule",
      "params": [0.045, 0.2, 4, 6],
      "material": { "preset": "fabric", "color": "#2d6a4f" },
      "position": [-0.25, 0.92, -0.02],
      "parent": "figure_root"
    },
    {
      "name": "upper_arm_r",
      "type": "capsule",
      "params": [0.045, 0.2, 4, 6],
      "material": { "preset": "fabric", "color": "#2d6a4f" },
      "position": [0.25, 0.92, -0.02],
      "parent": "figure_root"
    },
    {
      "name": "lower_arm_l",
      "type": "capsule",
      "params": [0.04, 0.18, 4, 6],
      "material": { "color": "#e8c4a0", "roughness": 0.9 },
      "position": [-0.25, 0.68, 0.08],
      "rotation": [30, 0, 0],
      "parent": "figure_root"
    },
    {
      "name": "lower_arm_r",
      "type": "capsule",
      "params": [0.04, 0.18, 4, 6],
      "material": { "color": "#e8c4a0", "roughness": 0.9 },
      "position": [0.25, 0.68, 0.08],
      "rotation": [30, 0, 0],
      "parent": "figure_root"
    },
    {
      "name": "hand_l",
      "type": "roundedBox",
      "params": [0.06, 0.08, 0.03, 0.015, 2],
      "material": { "color": "#e8c4a0", "roughness": 0.9 },
      "position": [-0.25, 0.52, 0.18],
      "parent": "figure_root"
    },
    {
      "name": "hand_r",
      "type": "roundedBox",
      "params": [0.06, 0.08, 0.03, 0.015, 2],
      "material": { "color": "#e8c4a0", "roughness": 0.9 },
      "position": [0.25, 0.52, 0.18],
      "parent": "figure_root"
    },
    {
      "name": "upper_leg_l",
      "type": "capsule",
      "params": [0.06, 0.28, 4, 6],
      "material": { "preset": "fabric", "color": "#1e3a5f" },
      "position": [-0.1, 0.42, 0.2],
      "rotation": [80, 0, 0],
      "parent": "figure_root"
    },
    {
      "name": "upper_leg_r",
      "type": "capsule",
      "params": [0.06, 0.28, 4, 6],
      "material": { "preset": "fabric", "color": "#1e3a5f" },
      "position": [0.1, 0.42, 0.2],
      "rotation": [80, 0, 0],
      "parent": "figure_root"
    },
    {
      "name": "lower_leg_l",
      "type": "capsule",
      "params": [0.05, 0.3, 4, 6],
      "material": { "preset": "fabric", "color": "#1e3a5f" },
      "position": [-0.1, 0.22, 0.4],
      "parent": "figure_root"
    },
    {
      "name": "lower_leg_r",
      "type": "capsule",
      "params": [0.05, 0.3, 4, 6],
      "material": { "preset": "fabric", "color": "#1e3a5f" },
      "position": [0.1, 0.22, 0.4],
      "parent": "figure_root"
    },
    {
      "name": "foot_l",
      "type": "roundedBox",
      "params": [0.08, 0.06, 0.15, 0.02, 2],
      "material": { "color": "#2a2a2a", "roughness": 0.85 },
      "position": [-0.1, 0.03, 0.45],
      "parent": "figure_root"
    },
    {
      "name": "foot_r",
      "type": "roundedBox",
      "params": [0.08, 0.06, 0.15, 0.02, 2],
      "material": { "color": "#2a2a2a", "roughness": 0.85 },
      "position": [0.1, 0.03, 0.45],
      "parent": "figure_root"
    }
  ]
}
