{
  "name": "palm-tree",
  "description": "Tropical palm tree with curved trunk and fronds",
  "root": "palm_root",
  "parts": [
    {
      "name": "palm_root",
      "type": "group",
      "position": [0, 0, 0]
    },
    {
      "name": "trunk_base",
      "type": "cylinder",
      "params": [0.18, 0.22, 0.5, 8],
      "material": { "preset": "wood", "color": "#6b5a4a" },
      "position": [0, 0.25, 0],
      "parent": "palm_root"
    },
    {
      "name": "trunk_lower",
      "type": "cylinder",
      "params": [0.15, 0.18, 1.5, 8],
      "material": { "preset": "wood", "color": "#7a6a5a" },
      "position": [0.05, 1.25, 0],
      "rotation": [3, 0, 0],
      "parent": "palm_root"
    },
    {
      "name": "trunk_upper",
      "type": "cylinder",
      "params": [0.12, 0.15, 1.5, 8],
      "material": { "preset": "wood", "color": "#8a7a6a" },
      "position": [0.12, 2.7, 0.05],
      "rotation": [5, 0, 0],
      "parent": "palm_root"
    },
    {
      "name": "crown",
      "type": "sphere",
      "params": [0.25, 1],
      "material": { "preset": "foliage", "color": "#3a6a2a" },
      "position": [0.15, 3.5, 0.1],
      "parent": "palm_root"
    },
    {
      "name": "frond_1",
      "type": "cone",
      "params": [0.15, 1.2, 4],
      "material": { "preset": "foliage", "color": "#2a5a1a" },
      "position": [0.8, 3.3, 0.1],
      "rotation": [20, 0, 70],
      "parent": "palm_root"
    },
    {
      "name": "frond_2",
      "type": "cone",
      "params": [0.15, 1.3, 4],
      "material": { "preset": "foliage", "color": "#3a6a2a" },
      "position": [-0.5, 3.4, 0.6],
      "rotation": [30, 120, 65],
      "parent": "palm_root"
    },
    {
      "name": "frond_3",
      "type": "cone",
      "params": [0.15, 1.2, 4],
      "material": { "preset": "foliage", "color": "#2a5a1a" },
      "position": [-0.5, 3.35, -0.5],
      "rotation": [-25, -120, 70],
      "parent": "palm_root"
    },
    {
      "name": "frond_4",
      "type": "cone",
      "params": [0.12, 1.1, 4],
      "material": { "preset": "foliage", "color": "#3a6a2a" },
      "position": [0.4, 3.5, -0.6],
      "rotation": [-35, -40, 60],
      "parent": "palm_root"
    },
    {
      "name": "frond_5",
      "type": "cone",
      "params": [0.14, 1.0, 4],
      "material": { "preset": "foliage", "color": "#2a5a1a" },
      "position": [0.15, 3.8, 0.1],
      "rotation": [0, 0, 15],
      "parent": "palm_root"
    },
    {
      "name": "coconut_1",
      "type": "sphere",
      "params": [0.08, 1],
      "material": { "color": "#5a4a3a", "roughness": 0.8 },
      "position": [0.25, 3.35, 0.15],
      "parent": "palm_root"
    },
    {
      "name": "coconut_2",
      "type": "sphere",
      "params": [0.07, 1],
      "material": { "color": "#5a4a3a", "roughness": 0.8 },
      "position": [0.1, 3.3, 0.2],
      "parent": "palm_root"
    }
  ]
}
